set_name,n,source_file,selection_or_role,relationship,claim_boundary,manual_validation_result
Rule-source ledger,132,data_processed/platform/rule_source_ledger_v1.csv,Curated traceable official/operator/reported/context rule records.,"Parent visible-rule ledger; 79 records enter main model, with other records retained for supplement, sensitivity, discovery, candidate or context roles.",A record supports source-grounded rule visibility; it does not imply all venues nearby are open.,127/132 pass (96.2%)
Main-model rule records,79,data_processed/platform/rule_source_ledger_v1.csv,publication_use_status == main_model.,Subset of 132 ledger records.,Used in model-facing rule evidence only within declared source hierarchy.,
Mined queue,26,data_processed/platform/round_mining_evidence_ledger_v2.csv,Additional mined records retained pending manual review.,Not promoted into main rule corpus.,Discovery/triage layer only unless manually verified.,
Priority rule-liminal validation queue,300,data_processed/validation/manual_validation_round1_300_priority_completed_utf8.csv,Priority candidate sample from rule-liminal hosts.,Sample from the much larger rule-liminal candidate universe.,"Candidate rows test verifiability; failed rows are non-verifiable, not closed venues.",38/300 pass (12.7%)
Stratified rule-liminal validation queue,1000,data_processed/validation/manual_validation_top1000_stratified_completed_utf8.csv,Stratified candidate sample from rule-liminal hosts.,Sample from the much larger rule-liminal candidate universe.,Designed to estimate how often candidate status converts into source-verifiable rule evidence.,77/1000 pass (7.7%)
Rule-liminal host universe,57994,data_processed/platform/rule_liminal_host_candidates_2025_v4.csv,Citywide host venues with plausible but unconfirmed pet-access rule publicisation potential.,Parent candidate universe for priority/stratified validation queues.,Not a map of confirmed pet-friendly venues.,
